{
  "$schema": "https://json-schema.org/draft/2020-12/schema",
  "title": "qa",
  "description": "Result of Render + QA for one platform variant of a storyboard.",
  "type": "object",
  "required": [
    "storyboard_id",
    "platform",
    "pass",
    "checks"
  ],
  "additionalProperties": false,
  "properties": {
    "storyboard_id": {
      "type": "string",
      "minLength": 1
    },
    "platform": {
      "enum": [
        "youtube",
        "instagram",
        "facebook"
      ]
    },
    "pass": {
      "type": "boolean"
    },
    "checks": {
      "type": "array",
      "minItems": 1,
      "items": {
        "type": "object",
        "required": [
          "name",
          "pass"
        ],
        "additionalProperties": false,
        "if": {
          "properties": {
            "pass": {
              "const": false
            }
          }
        },
        "then": {
          "required": [
            "error"
          ]
        },
        "properties": {
          "name": {
            "enum": [
              "schema",
              "text-limits",
              "audio",
              "format",
              "duration",
              "safe-zones",
              "fingerprint",
              "naming",
              "manifest",
              "cta",
              "destination",
              "seo",
              "motion",
              "creative"
            ]
          },
          "pass": {
            "type": "boolean"
          },
          "error": {
            "type": "string",
            "minLength": 1,
            "description": "Exact error sent back to Forge; required when pass is false"
          },
          "warning": {
            "type": "string",
            "minLength": 1,
            "description": "Advice for Navin, shown with the approval; never fails QA"
          }
        }
      }
    },
    "video_path": {
      "type": "string"
    },
    "contact_sheet_path": {
      "type": "string"
    },
    "text_boxes": {
      "type": "array",
      "items": {
        "type": "object"
      }
    },
    "video_sha256": {
      "type": "string",
      "pattern": "^[0-9a-f]{64}$",
      "description": "SHA-256 of the video file QA checked; approval and dispatch accept the result only for exactly that file"
    }
  }
}
