{
  "storyboard_id": "host-supplier-bills",
  "platform": "youtube",
  "pass": false,
  "checks": [
    {
      "name": "schema",
      "pass": true
    },
    {
      "name": "text-limits",
      "pass": true
    },
    {
      "name": "duration",
      "pass": true
    },
    {
      "name": "safe-zones",
      "pass": false,
      "error": "scene 2 (ui-inbox) \"BY HAND\": outside the youtube safe area (x 895..979, y 311..337)"
    }
  ],
  "video_path": "engine/out/c1-automation/2026-10-12/host-supplier-bills/youtube/c1-automation-youtube-2026-10-12-host-supplier-bills.mp4",
  "contact_sheet_path": "engine/out/c1-automation/2026-10-12/host-supplier-bills/youtube/c1-automation-youtube-2026-10-12-host-supplier-bills.contact.png"
}
